input,target,output,MA,SP,G,model
"Where art thou, O Muse, that thou dost forgetest me so long in thy absence?","Where art thou Muse that thou forgetest so long,",where art thou o muse that thou dost forgetest me so long in thy absence,1.0,1.0,0.1639,DP Reorderer
"Say, where art thou, Muse, that thou forgetest thy poet so very long?","Where art thou Muse that thou forgetest so long,",say where art thou muse that forgetest thou thy poet so very long,1.0,0.9972,0.1367,DP Reorderer
"O tell me where art thou, Muse, seeing that thou forgetest us all so long?","Where art thou Muse that thou forgetest so long,",o tell me where art thou muse seeing that thou forgetest us all so long,1.0,1.0,0.1519,DP Reorderer
"In gentle numbers doth time pass away, so very idly spent and wasted thus;",In gentle numbers time so idly spent;,in gentle numbers doth time pass away so very idly spent and wasted thus,1.0,1.0,0.1275,DP Reorderer
"So idly hath time been in gentle numbers spent, and all thy hours consumed;",In gentle numbers time so idly spent;,so idly hath time been in gentle numbers spent and all thy hours consumed,1.0,1.0,0.1177,DP Reorderer
"Time, spent in gentle numbers, passeth so idly hence, and is most foolishly consumed;",In gentle numbers time so idly spent;,time spent in gentle numbers passeth so idly hence and is most foolishly consumed,1.0,1.0,0.1266,DP Reorderer
"Make answer, O Muse, I prithee: wilt thou not haply say unto me what I most desperately seek?","Make answer Muse: wilt thou not haply say,",make answer o muse i prithee wilt thou not haply say unto me what i most desperately seek,1.0,1.0,0.1409,DP Reorderer
"Wilt thou not haply make answer, dear Muse, and say what thy heart doth know?","Make answer Muse: wilt thou not haply say,",wilt thou haply not make answer dear and muse say what thy heart doth know,1.0,0.9796,0.1392,DP Reorderer
"Make thy answer known, sweet Muse, I do beseech thee: wilt thou not haply deign to say?","Make answer Muse: wilt thou not haply say,",make answer thy known sweet muse i beseech do thee wilt thou not haply deign to say,1.0,0.9849,0.153,DP Reorderer
"Which vulgar scandal hath been stamped upon my brow most cruelly, leaving its mark upon my very countenance.",Which vulgar scandal stamped upon my brow;,which vulgar scandal hath been stamped upon my brow most cruelly leaving its mark upon my very countenance,1.0,1.0,0.1616,DP Reorderer
"The which most vulgar scandal, being stamped upon my brow, doth serve as a shameful brand for all to witness.",Which vulgar scandal stamped upon my brow;,the which most vulgar scandal being stamped upon my brow doth serve as a shameful brand for all to witness,1.0,1.0,0.1451,DP Reorderer
"Upon my brow, I say, there is stamped a scandal most vulgar, which now remaineth there as a testament to my shame.",Which vulgar scandal stamped upon my brow;,upon my brow i say there is a stamped scandal most vulgar which now remaineth there as a testament to my shame,1.0,0.9933,0.1373,DP Reorderer
"Creating of every bad thing a perfect best, thou dost transform all imperfection into excellence most pure.","Creating every bad a perfect best,",creating of bad thing perfect a every best thou dost transform all imperfection into excellence most pure,1.0,0.9875,0.1325,DP Reorderer
"In creating, every bad and wretched thing doth become a perfect best through thy divine alchemy.","Creating every bad a perfect best,",in bad creating thing and wretched every doth become a perfect best through thy divine alchemy,1.0,0.9774,0.1207,DP Reorderer
"By creating, thou makest every bad to be a perfect best, transmuting darkness into the fairest light.","Creating every bad a perfect best,",creating by thou makest bad to every be a perfect best transmuting darkness into the fairest light,1.0,0.958,0.1479,DP Reorderer
"And when ruined love is built anew, it doth arise again from its ashes.","And ruined love, when it is built anew,",and ruined when love is anew built it doth arise again from its ashes,1.0,0.956,0.1356,DP Reorderer
"When love, though ruined, is built anew, and reconstructed by faithful hands, it shall endure.","And ruined love, when it is built anew,",when love though ruined is and built anew reconstructed by faithful hands it shall endure,1.0,0.9959,0.1138,DP Reorderer
"And love, though ruined and laid waste, when it is built anew shall flourish once more.","And ruined love, when it is built anew,",and ruined love and though laid waste when it is built anew shall flourish once more,1.0,0.9688,0.1347,DP Reorderer
"And rather make them to be born unto our desire, as creatures fashioned by our will.",And rather make them born to our desire,and rather make them to be unto born our desire as creatures fashioned by our will,1.0,0.9912,0.13,DP Reorderer
"Make them rather born to serve our desire, and so shall they come forth as we do wish.",And rather make them born to our desire,make rather them born to desire serve our and so shall they come forth as we do wish,1.0,0.9775,0.1402,DP Reorderer
"And rather shall we make them born to our desire, that they might answer to our wants.",And rather make them born to our desire,and rather shall we make them born to our desire that they might answer to our wants,1.0,1.0,0.1765,DP Reorderer
"Yet in good faith, I say that some do behold thee most clearly.","Yet, in good faith, some say that thee behold,",in yet good faith i say that some behold do thee most clearly,1.0,0.9488,0.1147,DP Reorderer
"Some say, in good faith, that they behold thee, and yet 'tis true.","Yet, in good faith, some say that thee behold,",some say in good faith that behold they thee and yet tis true,1.0,0.9703,0.1452,DP Reorderer
"In good faith, yet some there be that say they behold thee with their own eyes.","Yet, in good faith, some say that thee behold,",in good faith yet some there be that say they behold thee with their own eyes,1.0,1.0,0.1589,DP Reorderer
"And sue a friend who came to be my debtor for my sake, in that I did extend unto him kindness.",And sue a friend came debtor for my sake;,and sue a friend who came to be my debtor for my sake in that i did extend unto him kindness,1.0,1.0,0.1533,DP Reorderer
"A friend came unto me, and I did sue him for to be my debtor, all for my own sake and benefit.",And sue a friend came debtor for my sake;,a friend came unto me and i did sue him for to be my debtor all for my own sake and benefit,1.0,1.0,0.1736,DP Reorderer
"And there came a friend whom I did sue, making him my debtor, yet all was done for my sake alone.",And sue a friend came debtor for my sake;,and there a came friend whom i did sue making him my debtor yet all was done for my sake alone,1.0,0.9964,0.1363,DP Reorderer
"In faith, I do not love thee with mine eyes, but rather with a deeper affection that transcendeth mere sight.","In faith I do not love thee with mine eyes,",in faith i do not love thee with mine eyes but rather with a deeper affection that transcendeth mere sight,1.0,1.0,0.1702,DP Reorderer
"Verily, in faith, I say unto thee that with mine eyes alone do I not love thee, for my heart doth hold a truer regard.","In faith I do not love thee with mine eyes,",verily faith in i say unto thee that with mine eyes alone do i not love thee for my heart doth hold a truer regard,1.0,0.9903,0.1548,DP Reorderer
"I do confess in faith that 'tis not with mine eyes that I love thee, nay, but with mine soul's most earnest devotion.","In faith I do not love thee with mine eyes,",i do confess in faith that tis not with mine eyes that i love thee nay but with mine souls most earnest devotion,1.0,1.0,0.1617,DP Reorderer
The worser spirit hath a woman coloured most ill and foul.,The worser spirit a woman coloured ill.,the hath worser spirit most a woman coloured ill and foul,1.0,0.9741,0.1102,DP Reorderer
A woman coloured ill doth harbour the worser spirit within her breast.,The worser spirit a woman coloured ill.,a woman coloured harbour ill the doth worser spirit within her breast,1.0,0.9324,0.1136,DP Reorderer
"The spirit, being worser in its nature, hath coloured a woman most ill.",The worser spirit a woman coloured ill.,the spirit being its worser hath in nature coloured a woman most ill,1.0,0.9878,0.1173,DP Reorderer
"Shall worms, those inheritors of this most grievous excess, consume what remains?","Shall worms, inheritors of this excess,",shall worms inheritors those of this most grievous excess consume what remains,1.0,0.9917,0.124,DP Reorderer
"Shall the worms, inheritors as they are of this excess most foul, lay claim to thy mortal form?","Shall worms, inheritors of this excess,",the shall inheritors worms as they are of this excess most foul lay claim to thy mortal form,1.0,0.9807,0.1243,DP Reorderer
"Shall worms become the inheritors of all this excess, and feast upon thy corrupted flesh?","Shall worms, inheritors of this excess,",the shall inheritors worms become of all this excess and feast upon thy corrupted flesh,1.0,0.9822,0.123,DP Reorderer
When I do against myself with thee partake in this most grievous conflict?,When I against myself with thee partake?,when i against do with partake thee myself in this most grievous conflict,1.0,0.9451,0.1252,DP Reorderer
"When shall I against myself with thee partake, and thus betray mine own nature?",When I against myself with thee partake?,when shall against i with partake thee myself and thus betray mine own nature,1.0,0.969,0.1136,DP Reorderer
When dost I against myself with thee partake of such a bitter fellowship?,When I against myself with thee partake?,when dost against i with partake thee myself of such a bitter fellowship,1.0,0.9689,0.1157,DP Reorderer
"When I break twenty, I am most perjured in mine oath.",When I break twenty? I am perjured most;,when i break twenty i am perjured most in mine oath,1.0,0.9947,0.1181,DP Reorderer
"I am most perjured when I break twenty, forsooth.",When I break twenty? I am perjured most;,i am most perjured when i twenty break forsooth,1.0,0.9554,0.1202,DP Reorderer
"When I do break twenty, then am I most grievously perjured.",When I break twenty? I am perjured most;,when i do twenty break then am i most grievously perjured,1.0,0.984,0.1322,DP Reorderer
"And to enlighten thee, he gave eyes unto blindness itself, that sight might be restored.","And, to enlighten thee, gave eyes to blindness,",and to thee he gave unto blindness enlighten eyes itself that sight might be restored,1.0,0.9874,0.137,DP Reorderer
"To enlighten thee, and gave eyes to blindness did he, casting off the veil of darkness.","And, to enlighten thee, gave eyes to blindness,",to thee and gave eyes blindness to did enlighten he casting off the veil of darkness,1.0,0.9908,0.1337,DP Reorderer
"And gave eyes to blindness, to enlighten thee withal, restoring what was lost to darkness.","And, to enlighten thee, gave eyes to blindness,",and gave eyes blindness to to thee withal enlighten restoring what was lost to darkness,1.0,0.9816,0.1239,DP Reorderer
"Which did erst canopy the herd from heat, as a protective shelter doth.","Which erst from heat did canopy the herd,",woman body gently observe otherwise perplex come fellow indeed tally hammered answered thy afterwards mysteries cease chiding moan presumptuous visible condition rupture wholly cheater possessest wills recognize transform achieving recompense,0.2,0.0,0.0957,GRU Attention
"And right perfection, which hath been wrongfully disgraced by villainous hands","And right perfection wrongfully disgraced,",if spend miles speed seated summon courses witness begone mysteriously sharp theerise celestial worn reign nature presumptuous issued rank abide none mans muse chide keep longlived robe raiment thy unused,0.4,0.1806,0.1007,GRU Attention
"The weary night doth claim my heavy eyelids, and to it shall they fall?",My heavy eyelids to the weary night?,if spend restraining plainly pretense conjoined discovered living dwellsthat surely utterance mans chide muse instrument proudpied dulness curse touch beauteous piercing proper alteration journey exposed minds alike thisif bent sorrows,0.8,0.3939,0.1055,GRU Attention
"Time, spent in gentle numbers, passeth so idly hence, and is most foolishly consumed;",In gentle numbers time so idly spent;,if spend restraining plainly pretense conjoined discovered living dwellsthat surely utterance mans chide muse instrument proudpied dulness giveth raiment sea sealed visible called deception whether beg sorrowful within fingers strumpeted,0.8,0.3578,0.1079,GRU Attention
"Despise not the wrinkles that come upon thee, for this thy golden time doth shine with splendour despite of such blemishes.",Despite of wrinkles this thy golden time.,woman body gently observe robe movd page humble tongue savour tigers witnessed contrary separable visit thisif reduce prized respite much hate strumpeted stately stern only rise bent remembered argue foe,0.3,0.2705,0.0999,GRU Attention
"Shall worms, those inheritors of this most grievous excess, consume what remains?","Shall worms, inheritors of this excess,",woman body gently observe begone unwooed taken eclipses violently spend tread voice restraining razed excuse preserving altered labour earth tongue sea remembered to wilt lungs hate union rank strumpeted certainty,0.3,0.204,0.1008,GRU Attention
"Make thee another self, I do beseech thee, for the love of me, thy most devoted servant.","Make thee another self for love of me,",if spend restraining plainly pretense conjoined discovered living altering noise dream work adding exist striving deaf fro themselves immortality ceremony subject decree marvel instrument proposed transcend displayed loudly surpassing thy,0.8,0.294,0.087,GRU Attention
"One seeketh by toil to labor, the other to complain with grievous voice.","The one by toil, the other to complain",if spend restraining plainly pretense conjoined discovered living dwellsthat surely utterance mans chide muse instrument proudpied dulness curse touch beauteous piercing proper alteration journey exposed minds alike thisif bent sorrows,0.8,0.4474,0.1055,GRU Attention
"And the purest faith, most unhappily forsworn by thee, doth grieve the soul.","And purest faith unhappily forsworn,",woman body gently observe deception alike exposed defying whence guess lovely leap region earth well courses meant needs sworn hammered shinest responsibility inexorable folly yield divided meek burning strange across,0.4,0.3447,0.0902,GRU Attention
"And rather make them to be born unto our desire, as creatures fashioned by our will.",And rather make them born to our desire,if spend miles speed seated summon courses seas learned whose imagining dearly passage sooth discovered to reduce story noise recount perceiveth from parts destroy worthy match fragments damned vault anguished,0.4,0.2866,0.0924,GRU Attention
"Whether we are mended, or whether they be better in their estate and condition","whether we are mended, or whether better they,",if spend miles speed urgency laying plainly begone stoln presumptuous proudpied abuse swift comfort perceiveth reduce moves firmly brain reach alteration vestments smell stand these commence tidings behold wield chide,0.8,0.2282,0.1003,GRU Attention
From heat did that which erst canopy the herd with sheltering boughs.,"Which erst from heat did canopy the herd,",woman body gently observe begone unwooed taken got wasted recompense prescribed stoln presumptuous page unused bond stir conscience stately seen faults as utmost thousand fervently press fate proceed hollow called,0.3,0.0864,0.1008,GRU Attention
Behold how these present-absent slide with swift motion through the ethereal sphere.,These present-absent with swift motion slide.,woman body needs perceiveth transgression parts flourish giftthese on open savour given possessest wills spend grasp summon courses meant whose come dressed truly reduce respite thing starry wrong or race,0.5,0.1919,0.099,GRU Attention
"And for true things deemed worthy, to truths translated from their native form.","To truths translated, and for true things deemed.",woman body gently observe otherwise perplex accept ay out subject war alteration chide muse speed urgency testify above outlive rebellion remain vessel hammered persistently tongue destination sweet various unused would,0.2,0.2799,0.0897,GRU Attention
"Thy inward love of heart, and my heart's right, art both most noble and sincere.","And my heart's right, thy inward love of heart.",if spend miles speed seated summon courses meant and creatures learning filled with chide linger drained face certain submission heir loan oblivion dressingsmere immediate yield divided meek violate lesser rudely,0.4,0.1903,0.0943,GRU Attention
"Which this thing, Time's pencil, or my pupil pen doth mark upon the page?","Which this, Time's pencil, or my pupil pen,",if spend miles speed fame seem feeding recount sing discourse mother loving glazed comfort alteration myself sacred grown heal bestir these more fortified recompense broke peculiar imagining alike lavish lewd,0.8,0.0937,0.0873,GRU Attention
Doth my heavy eyelids now surrender to the weary night that cometh upon me?,My heavy eyelids to the weary night?,if spend miles speed fame seem transformed responsibility muse anew attendeth exposed open devoid adore striving fragments tender alteration myself come dressed chide see stately away preserving distant earnestly brightly,1.0,0.3363,0.091,GRU Attention
"Those whom nature hath not made for store — let them depart, I say, for they were never fashioned by her hand for such purpose.","Let those whom nature hath not made for store,",if spend restraining plainly pretense conjoined discovered living altering noise dream obscured gently desire begone preserving come dressed brain displayed agency how divert view visit lie truly didst confessi having,0.8,0.227,0.094,GRU Attention
"It shall to itself only live and die, though such a creature, bound unto itself, must inevitably expire","Though to itself, it only live and die,",if spend miles speed seated summon courses meant and creatures learning filled with chide linger drained afterwards tigers come memory submission grand exposed shoulders proven wretches bond anew presumptuous fairest,0.4,0.3473,0.0978,GRU Attention
And my heart's right in this: that thy inward love of heart remaineth ever constant.,"And my heart's right, thy inward love of heart.",if villainous reproof stern brightness desert drives astray mysteriously discovered living reduce fullness as more ere on proudmost delight vows pluck form violently spend restraining plainly pretense conjoined vault chains,0.5,0.1841,0.1075,GRU Attention
To each and every hymn that any able spirit may affords unto thee with bounty,"To every hymn that able spirit affords,",woman body gently observe otherwise accept presumptuous page humble tongue perusal wane remembered to step flames book linger covered counsel rank visit bare end fervently most surely utterance mans chide,0.2,0.2929,0.1038,GRU Attention
"Thy robbery, though it be a crime most grievous, I do forgive thee, gentle thief that thou art, with a heart full of charity.","I do forgive thy robbery, gentle thief,",woman body gently observe robe unfolding movd vows on world sick aging belongs separable ceremony weep absolve peril grown heal bestir reckoning it presumptuous issued rank strumpeted approach think lives,0.3,0.2846,0.0998,GRU Attention
"When shall I against myself with thee partake, and thus betray mine own nature?",When I against myself with thee partake?,woman body gently observe begone unwooed taken got wasted recompense prescribed enchantment revealed master morrowgive adjunct various chains poesy lead forced breast cruel bare diligent deny chamber force fierce abandonment,0.3,0.3109,0.0978,GRU Attention
"The other two elements, being but slight air and purging fire, do constitute the heavens.","The other two, slight air, and purging fire",if spend restraining plainly pretense conjoined vault chains creatures dialhand esteem fickle stand hereafter enchantment curious yielded endure faults less morrowgive pinnacle view deceitful contemplation spurring splendor mysteries purest unscathed,0.8,0.1919,0.0993,GRU Attention
"And sue a friend who came to be my debtor for my sake, in that I did extend unto him kindness.",And sue a friend came debtor for my sake;,woman body gently observe otherwise restraint sever work warm presumptuous page begone reckoning whereon young blow therein overread burns excuse sing worthy transformed me anguished invest whereby drives give journey,0.2,0.1612,0.0984,GRU Attention
"Though I, once gone from this mortal realm, must die to all the world and be remembered no more;","Though I, once gone, to all the world must die:",if spend miles speed fame choice myself thither contemplation wills acknowledge come perceiveth transgression parts disabled satisfied help alteration recount discourse wrongs point departed entire white great affections reproof stern,0.8,0.2584,0.0996,GRU Attention
"The one doth labor by toil, whilst the other doth turn to complain.","The one by toil, the other to complain",woman body gently observe deception truly ventures exposed shameless practice consider autumn stand tyrannous seeing flanks purposes contend giftthese on open whereby neglect endeavours revolution linger moved journey mine crooked,0.4,0.2689,0.0898,GRU Attention
"And so perfection, being right and true, is wrongfully disgraced in this world","And right perfection wrongfully disgraced,",if spend miles speed seated invest human departed entire hate theerise oath myself assured got part therefore much mischief labour earth tongue sea division shameless practice giveth desert drives astray,0.5,0.3405,0.0951,GRU Attention
"It is perspective, and the very best of all painter's art, I say.",And perspective it is best painter's art.,if spend miles speed fame choice myself thither contemplation wills acknowledge come perceiveth transgression parts name counterpart uprear welcome sea these remain exist entire teeth striving antique didst those society,0.8,0.1392,0.0966,GRU Attention
"Thinly placed are they, like unto stones of worth, arranged as treasures distributed with sparing hand across the expanse.","Like stones of worth they thinly placed are,",woman body gently observe otherwise restraint sever notwithstanding outlive rebellion remain verses book shameful command linger prized weapons on delight see stately thing chide last certainty this chronicle standing bearest,0.2,0.3457,0.0976,GRU Attention
"In creating, every bad and wretched thing doth become a perfect best through thy divine alchemy.","Creating every bad a perfect best,",if spend restraining plainly pretense conjoined discovered living dwellsthat surely utterance mans chide muse instrument proudpied dulness giveth verily selfloving gaining inclind less holding gifts loving oath myself brought looks,0.8,0.3619,0.1023,GRU Attention
"For true things deemed, and to truths that have been translated hither.","To truths translated, and for true things deemed.",if spend miles speed seated great satisfied diligent concern splendor afresh strumpeted forcefully wooed swift nothing condition outlive rebellion called on stubborn grasp gauge spite lesser remembered to even infection,0.8,0.2117,0.1029,GRU Attention
Then shall the conceit of this most inconstant stay torment thy weary soul,Then the conceit of this inconstant stay,if villainous reproof stern brightness desert drives astray mysteriously discovered noise me fashion speed anew exposed chide guess both thisif end burn lives shape defying arise muse instrument proudpied writ,0.5,0.3107,0.0987,GRU Attention
"To stop posterity, his self-love—of what consequence is it?",Of his self-love to stop posterity?,woman body gently observe otherwise accept drives tigers come mysteries destruction work fashion consent beauteous flanks contend villainous restraining try giftthese enchantment respite belong hounds book coin splendor tiresome follow,0.2,0.1191,0.1026,GRU Attention
"Which vulgar scandal hath been stamped upon my brow most cruelly, leaving its mark upon my very countenance.",Which vulgar scandal stamped upon my brow;,woman body gently observe deception alike lavish lewd forced muse speed oaths thousand passage with chide hate scanted remaining anew exposed clean presumptuous remembered to violently spend miles revealed mother,0.4,0.3451,0.0956,GRU Attention
"The purest faith, unhappily and most cruelly forsworn, doth lie in ruins.","And purest faith unhappily forsworn,",woman body gently observe otherwise perplex come reproof stern blot presumptuous remembered flames chide import linger living morrow with restraining razed entrance cheated giveth needs seeketh art void submission grand,0.2,0.2293,0.1006,GRU Attention
"When other petty griefs have done their spite upon thee, and all their malice hath been spent","When other petty griefs have done their spite,",if spend miles speed fame counterpart region every stand tyrannous although society solitary deceit stay cheated realm shinest responsibility perfectly meek eisel garnered common gaining counsel fate on gifts command,0.8,0.3356,0.0889,GRU Attention
"Every hymn to which that able spirit affords itself, thou shalt attend with reverence","To every hymn that able spirit affords,",woman body gently observe otherwise accept drives tigers come chide see perambulation arrow ways grand responsibility muse cheated lays sometime moveth depths across me much altogether fault constant minutes remembered,0.2,0.232,0.0914,GRU Attention
"The spirit, being worser in its nature, hath coloured a woman most ill.",The worser spirit a woman coloured ill.,woman body gently observe otherwise perplex come shameful page begone endeavour these violence put wrongfully labours fro hear tigers mysteries destruction hate union lack movd winter creation light none foes,0.2,0.414,0.0948,GRU Attention
